budget,genres,homepage,id,keywords,original_language,original_title,overview,popularity,production_companies,production_countries,release_date,revenue,runtime,spoken_languages,status,tagline,title,vote_average,vote_count
6500000,"[{""id"": 18, ""name"": ""Drama""}, {""id"": 36, ""name"": ""History""}, {""id"": 10752, ""name"": ""War""}]",,1116,"[{""id"": 212, ""name"": ""london england""}, {""id"": 380, ""name"": ""brother brother relationship""}, {""id"": 392, ""name"": ""england""}, {""id"": 393, ""name"": ""civil war""}, {""id"": 836, ""name"": ""resistance""}, {""id"": 1008, ""name"": ""guerrilla""}, {""id"": 1208, ""name"": ""irland""}, {""id"": 1353, ""name"": ""underground""}, {""id"": 1756, ""name"": ""opression""}, {""id"": 2052, ""name"": ""traitor""}, {""id"": 3070, ""name"": ""mercenary""}, {""id"": 4097, ""name"": ""independence""}, {""id"": 4100, ""name"": ""british army""}, {""id"": 4729, ""name"": ""dublin""}, {""id"": 4730, ""name"": ""irish civil war""}, {""id"": 6057, ""name"": ""peace""}, {""id"": 6110, ""name"": ""weapon""}, {""id"": 12579, ""name"": ""irish republican army""}, {""id"": 15202, ""name"": ""rural ireland""}, {""id"": 158217, ""name"": ""colonialism""}]",en,The Wind That Shakes the Barley,"Set during the 1920s Irish revolution against the British, an Irish medical student is about to start his new job in London  but after he witnesses the mercenary atrocities of the British, he decides to join his brother in the IRA to fight for Irish independence.",6.787967,"[{""name"": ""BIM Distribuzione"", ""id"": 225}, {""name"": ""Matador Pictures"", ""id"": 707}, {""name"": ""Diaphana Films"", ""id"": 744}, {""name"": ""B\u00f3rd Scann\u00e1n na h\u00c9ireann"", ""id"": 1898}, {""name"": ""Element Films"", ""id"": 2274}, {""name"": ""UK Film Council"", ""id"": 2452}, {""name"": ""Path\u00e9 Distribution"", ""id"": 3012}, {""name"": ""Irish Film Board"", ""id"": 5267}, {""name"": ""Tornasol Films"", ""id"": 7680}, {""name"": ""Sixteen Films"", ""id"": 12695}, {""name"": ""Regent Capital"", ""id"": 12696}, {""name"": ""EMC Produktion"", ""id"": 19929}, {""name"": ""Cin\u00e9art"", ""id"": 19930}, {""name"": ""TV3 Television Network Ireland"", ""id"": 19931}, {""name"": ""Filmcoopi Z\u00fcrich"", ""id"": 19932}, {""name"": ""Oil Flick Films No.2"", ""id"": 19933}]","[{""iso_3166_1"": ""IE"", ""name"": ""Ireland""}, {""iso_3166_1"": ""GB"", ""name"": ""United Kingdom""}, {""iso_3166_1"": ""DE"", ""name"": ""Germany""}, {""iso_3166_1"": ""IT"", ""name"": ""Italy""}, {""iso_3166_1"": ""ES"", ""name"": ""Spain""}, {""iso_3166_1"": ""FR"", ""name"": ""France""}, {""iso_3166_1"": ""BE"", ""name"": ""Belgium""}, {""iso_3166_1"": ""CH"", ""name"": ""Switzerland""}]",5/18/2006,22889018,124,"[{""iso_639_1"": ""en"", ""name"": ""English""}, {""iso_639_1"": ""ga"", ""name"": ""Gaeilge""}, {""iso_639_1"": ""la"", ""name"": ""Latin""}]",Released,Winner of the PALME D'OR at the 2006 Cannes Film Festival.,The Wind That Shakes the Barley,7.1,154
19000000,"[{""id"": 14, ""name"": ""Fantasy""}, {""id"": 18, ""name"": ""Drama""}, {""id"": 10752, ""name"": ""War""}]",http://www.panslabyrinth.com,1417,"[{""id"": 514, ""name"": ""spain""}, {""id"": 836, ""name"": ""resistance""}, {""id"": 964, ""name"": ""servant""}, {""id"": 2095, ""name"": ""anti hero""}, {""id"": 2710, ""name"": ""fairy""}, {""id"": 3205, ""name"": ""fairy tale""}, {""id"": 5882, ""name"": ""franco regime""}, {""id"": 6092, ""name"": ""army""}, {""id"": 7376, ""name"": ""princess""}, {""id"": 9673, ""name"": ""love""}, {""id"": 9720, ""name"": ""woods""}, {""id"": 13084, ""name"": ""king""}, {""id"": 18028, ""name"": ""hiding""}, {""id"": 18129, ""name"": ""labyrinth""}, {""id"": 207003, ""name"": ""mythological""}]",es,El laberinto del fauno,"Living with her tyrannical stepfather in a new home with her pregnant mother, 10-year-old Ofelia feels alone until she explores a decaying labyrinth guarded by a mysterious faun who claims to know her destiny. If she wishes to return to her real father, Ofelia must complete three terrifying tasks.",90.809408,"[{""name"": ""Estudios Picasso"", ""id"": 2029}, {""name"": ""Esperanto Filmoj"", ""id"": 7470}, {""name"": ""Tequila Gang"", ""id"": 11628}]","[{""iso_3166_1"": ""ES"", ""name"": ""Spain""}, {""iso_3166_1"": ""US"", ""name"": ""United States of America""}, {""iso_3166_1"": ""MX"", ""name"": ""Mexico""}]",5/27/2006,83258226,118,"[{""iso_639_1"": ""es"", ""name"": ""Espa\u00f1ol""}]",Released,What happens when make-believe believes it's real?,Pan's Labyrinth,7.6,3041
200000000,"[{""id"": 12, ""name"": ""Adventure""}, {""id"": 14, ""name"": ""Fantasy""}, {""id"": 28, ""name"": ""Action""}]",http://disney.go.com/disneypictures/pirates/,58,"[{""id"": 616, ""name"": ""witch""}, {""id"": 663, ""name"": ""fortune teller""}, {""id"": 910, ""name"": ""bondage""}, {""id"": 911, ""name"": ""exotic island""}, {""id"": 1299, ""name"": ""monster""}, {""id"": 1316, ""name"": ""captain""}, {""id"": 1317, ""name"": ""card game""}, {""id"": 1319, ""name"": ""east india trading company""}, {""id"": 1461, ""name"": ""compass""}, {""id"": 3799, ""name"": ""ship""}, {""id"": 5600, ""name"": ""daughter""}, {""id"": 12988, ""name"": ""pirate""}, {""id"": 157186, ""name"": ""swashbuckler""}, {""id"": 179430, ""name"": ""aftercreditsstinger""}]",en,Pirates of the Caribbean: Dead Man's Chest,"Captain Jack Sparrow works his way out of a blood debt with the ghostly Davey Jones, he also attempts to avoid eternal damnation.",145.847379,"[{""name"": ""Walt Disney Pictures"", ""id"": 2}, {""name"": ""Jerry Bruckheimer Films"", ""id"": 130}, {""name"": ""Second Mate Productions"", ""id"": 19936}]","[{""iso_3166_1"": ""JM"", ""name"": ""Jamaica""}, {""iso_3166_1"": ""US"", ""name"": ""United States of America""}, {""iso_3166_1"": ""BS"", ""name"": ""Bahamas""}, {""iso_3166_1"": ""DM"", ""name"": ""Dominica""}]",6/20/2006,1065659812,151,"[{""iso_639_1"": ""en"", ""name"": ""English""}, {""iso_639_1"": ""tr"", ""name"": ""T\u00fcrk\u00e7e""}, {""iso_639_1"": ""el"", ""name"": ""\u03b5\u03bb\u03bb\u03b7\u03bd\u03b9\u03ba\u03ac""}, {""iso_639_1"": ""zh"", ""name"": ""\u666e\u901a\u8bdd""}]",Released,Jack is back!,Pirates of the Caribbean: Dead Man's Chest,7,5246
35000000,"[{""id"": 35, ""name"": ""Comedy""}, {""id"": 18, ""name"": ""Drama""}, {""id"": 10749, ""name"": ""Romance""}]",http://www.devilwearspradamovie.com/,350,"[{""id"": 90, ""name"": ""paris""}, {""id"": 736, ""name"": ""journalist""}, {""id"": 917, ""name"": ""journalism""}, {""id"": 1854, ""name"": ""world of fasion""}, {""id"": 3486, ""name"": ""fashion journal""}, {""id"": 3487, ""name"": ""assistant""}, {""id"": 3488, ""name"": ""job entrant""}, {""id"": 3489, ""name"": ""job interview""}, {""id"": 4222, ""name"": ""editor-in-chief""}]",en,The Devil Wears Prada,The Devil Wears Prada is about a young journalist who moves to New York to work in the fashion industry. Her boss however is extremely demanding and cruel and wont let her succeed if she doesnt fit into the high class elegant look of their magazine when all she really wants to be a good journalist.,83.893257,"[{""name"": ""Twentieth Century Fox Film Corporation"", ""id"": 306}, {""name"": ""Dune Entertainment"", ""id"": 444}, {""name"": ""Major Studio Partners"", ""id"": 445}, {""name"": ""Peninsula Films"", ""id"": 682}, {""name"": ""Fox 2000 Pictures"", ""id"": 711}]","[{""iso_3166_1"": ""US"", ""name"": ""United States of America""}]",6/30/2006,326551094,109,"[{""iso_639_1"": ""en"", ""name"": ""English""}, {""iso_639_1"": ""fr"", ""name"": ""Fran\u00e7ais""}]",Released,Meet Andy Sachs. A million girls would kill to have her job. She's not one of them.,The Devil Wears Prada,7,3088
8000000,"[{""id"": 35, ""name"": ""Comedy""}, {""id"": 18, ""name"": ""Drama""}]",http://www.foxsearchlight.com/littlemisssunshine/,773,"[{""id"": 387, ""name"": ""california""}, {""id"": 1155, ""name"": ""brother sister relationship""}, {""id"": 1157, ""name"": ""wife husband relationship""}, {""id"": 2783, ""name"": ""family's daily life""}, {""id"": 3089, ""name"": ""oscar award""}, {""id"": 3306, ""name"": ""highway""}, {""id"": 3746, ""name"": ""professor for literature""}, {""id"": 5496, ""name"": ""beauty contest""}, {""id"": 5549, ""name"": ""beauty queen contest""}, {""id"": 7312, ""name"": ""road trip""}, {""id"": 10235, ""name"": ""family relationships""}, {""id"": 33694, ""name"": ""family holiday""}, {""id"": 167043, ""name"": ""road movie""}, {""id"": 187056, ""name"": ""woman director""}, {""id"": 191583, ""name"": ""beauty pageant""}]",en,Little Miss Sunshine,"A family loaded with quirky, colorful characters piles into an old van and road trips to California for little Olive to compete in a beauty pageant.",14.793177,"[{""name"": ""Fox Searchlight Pictures"", ""id"": 43}, {""name"": ""Bona Fide Productions"", ""id"": 2570}, {""name"": ""Big Beach Films"", ""id"": 12808}]","[{""iso_3166_1"": ""US"", ""name"": ""United States of America""}]",7/26/2006,100523181,102,"[{""iso_639_1"": ""en"", ""name"": ""English""}]",Released,A family on the verge of a breakdown,Little Miss Sunshine,7.5,1686
40000000,"[{""id"": 14, ""name"": ""Fantasy""}, {""id"": 18, ""name"": ""Drama""}, {""id"": 53, ""name"": ""Thriller""}, {""id"": 10749, ""name"": ""Romance""}]",,1491,"[{""id"": 2343, ""name"": ""magic""}, {""id"": 7376, ""name"": ""princess""}, {""id"": 9673, ""name"": ""love""}, {""id"": 9823, ""name"": ""rivalry""}, {""id"": 18267, ""name"": ""vienna austria""}, {""id"": 169456, ""name"": ""crown prince""}, {""id"": 176857, ""name"": ""duchess""}, {""id"": 188989, ""name"": ""supernatural power""}, {""id"": 209157, ""name"": ""childhood sweetheart""}, {""id"": 233055, ""name"": ""vienna""}]",en,The Illusionist,"With his eye on a lovely aristocrat, a gifted illusionist named Eisenheim uses his powers to win her away from her betrothed, a crowned prince. But Eisenheim's scheme creates tumult within the monarchy and ignites the suspicion of a dogged inspector.",36.960953,"[{""name"": ""Michael London Productions"", ""id"": 1187}, {""name"": ""Stillking Films"", ""id"": 11345}, {""name"": ""Bob Yari Productions"", ""id"": 12260}, {""name"": ""Bull's Eye Entertainment"", ""id"": 25432}, {""name"": ""Contagious Entertainment"", ""id"": 52740}, {""name"": ""Revolution Sun Studios"", ""id"": 76043}]","[{""iso_3166_1"": ""CZ"", ""name"": ""Czech Republic""}, {""iso_3166_1"": ""US"", ""name"": ""United States of America""}]",8/18/2006,86915017,110,"[{""iso_639_1"": ""en"", ""name"": ""English""}]",Released,Nothing Is What It Seems.,The Illusionist,7.1,1615
21000000,"[{""id"": 18, ""name"": ""Drama""}, {""id"": 53, ""name"": ""Thriller""}, {""id"": 10752, ""name"": ""War""}]",,9075,"[{""id"": 930, ""name"": ""in love with enemy""}, {""id"": 1199, ""name"": ""netherlands""}, {""id"": 1956, ""name"": ""world war ii""}, {""id"": 3246, ""name"": ""prosecution""}]",nl,Zwartboek,"In the Nazi-occupied Netherlands during World War II, a Jewish singer infiltrates the regional Gestapo headquarters for the Dutch resistance.",13.906611,"[{""name"": ""CoBo Fund"", ""id"": 234}, {""name"": ""Studio Babelsberg"", ""id"": 264}, {""name"": ""Motel Films"", ""id"": 865}, {""name"": ""Motion Investment Group"", ""id"": 1991}, {""name"": ""Egoli Tossell Film AG"", ""id"": 2254}, {""name"": ""Filmf\u00f6rderungsanstalt (FFA)"", ""id"": 4247}, {""name"": ""Nederlands Fonds voor de Film"", ""id"": 4508}, {""name"": ""Medienboard Berlin-Brandenburg"", ""id"": 7307}, {""name"": ""uFilm"", ""id"": 8676}, {""name"": ""Le Tax Shelter du Gouvernement F\u00e9d\u00e9ral de Belgique"", ""id"": 11921}, {""name"": ""Fu Works"", ""id"": 12046}, {""name"": ""Hector BV"", ""id"": 16618}, {""name"": ""Media Programme of the European Community"", ""id"": 21972}, {""name"": ""Euroimages Fund of the Council of Europe"", ""id"": 23192}, {""name"": ""VIP 4 Medienfonds"", ""id"": 23238}, {""name"": ""ContentFilm International"", ""id"": 25487}, {""name"": ""Clockwork Pictures"", ""id"": 25488}]","[{""iso_3166_1"": ""NL"", ""name"": ""Netherlands""}, {""iso_3166_1"": ""DE"", ""name"": ""Germany""}, {""iso_3166_1"": ""GB"", ""name"": ""United Kingdom""}]",9/1/2006,26193068,145,"[{""iso_639_1"": ""nl"", ""name"": ""Nederlands""}, {""iso_639_1"": ""de"", ""name"": ""Deutsch""}, {""iso_639_1"": ""en"", ""name"": ""English""}, {""iso_639_1"": ""he"", ""name"": ""\u05e2\u05b4\u05d1\u05b0\u05e8\u05b4\u05d9\u05ea""}]",Released,"To fight the enemy, she must become one of them.",Black Book,7.2,277
6000000,"[{""id"": 18, ""name"": ""Drama""}]",,1523,"[{""id"": 407, ""name"": ""dictator""}, {""id"": 1228, ""name"": ""1970s""}, {""id"": 1402, ""name"": ""general""}, {""id"": 1930, ""name"": ""kidnapping""}, {""id"": 2487, ""name"": ""naivety""}, {""id"": 2613, ""name"": ""luxury""}, {""id"": 3089, ""name"": ""oscar award""}, {""id"": 6750, ""name"": ""charisma""}, {""id"": 6751, ""name"": ""polygamy""}, {""id"": 7404, ""name"": ""uganda""}, {""id"": 7606, ""name"": ""dictatorship""}]",en,The Last King of Scotland,"Young Scottish doctor, Nicholas Garrigan decides it's time for an adventure after he finishes his formal education, so he decides to try his luck in Uganda, and arrives during the downfall of President Obote. General Idi Amin comes to power and asks Garrigan to become his personal doctor.",26.286954,"[{""name"": ""Fox Searchlight Pictures"", ""id"": 43}, {""name"": ""Cowboy Films"", ""id"": 245}, {""name"": ""DNA Films"", ""id"": 284}, {""name"": ""Scottish Screen"", ""id"": 698}, {""name"": ""UK Film Council"", ""id"": 2452}, {""name"": ""Filmfour"", ""id"": 6705}, {""name"": ""Slate Films"", ""id"": 20369}, {""name"": ""Tatfilm"", ""id"": 20370}]","[{""iso_3166_1"": ""GB"", ""name"": ""United Kingdom""}, {""iso_3166_1"": ""DE"", ""name"": ""Germany""}, {""iso_3166_1"": ""US"", ""name"": ""United States of America""}]",9/1/2006,48027970,121,"[{""iso_639_1"": ""en"", ""name"": ""English""}, {""iso_639_1"": ""fr"", ""name"": ""Fran\u00e7ais""}, {""iso_639_1"": ""de"", ""name"": ""Deutsch""}, {""iso_639_1"": ""sw"", ""name"": ""Kiswahili""}]",Released,Charming. Magnetic. Murderous.,The Last King of Scotland,7.4,558
30000000,"[{""id"": 35, ""name"": ""Comedy""}, {""id"": 18, ""name"": ""Drama""}, {""id"": 14, ""name"": ""Fantasy""}, {""id"": 10749, ""name"": ""Romance""}]",http://www.sonypictures.com/homevideo/strangerthanfiction/,1262,"[{""id"": 1992, ""name"": ""professor""}, {""id"": 2132, ""name"": ""literature""}, {""id"": 9673, ""name"": ""love""}, {""id"": 9799, ""name"": ""romantic comedy""}, {""id"": 10818, ""name"": ""author""}, {""id"": 10855, ""name"": ""fate""}, {""id"": 34079, ""name"": ""death""}, {""id"": 41589, ""name"": ""dying""}, {""id"": 155251, ""name"": ""novelist""}, {""id"": 188994, ""name"": ""publisher""}, {""id"": 215325, ""name"": ""what if""}]",en,Stranger Than Fiction,"Everybody knows that your life is a story. But what if a story was your life? Harold Crick is your average IRS agent: monotonous, boring, and repetitive. But one day this all changes when Harold begins to hear an author inside his head narrating his life. But when the narration reveals he is going to die, Harold must find the author and convince them to change the ending.",32.26789,"[{""name"": ""Mandate Pictures"", ""id"": 771}, {""name"": ""Three Strange Angels"", ""id"": 1973}]","[{""iso_3166_1"": ""US"", ""name"": ""United States of America""}]",9/9/2006,53653224,113,"[{""iso_639_1"": ""en"", ""name"": ""English""}]",Released,Harold Crick isn't ready to go. Period.,Stranger Than Fiction,7.1,721
2380000,"[{""id"": 18, ""name"": ""Drama""}, {""id"": 80, ""name"": ""Crime""}]",http://www.thisisenglandmovie.co.uk/,11798,"[{""id"": 65, ""name"": ""holiday""}, {""id"": 379, ""name"": ""skinhead""}, {""id"": 392, ""name"": ""england""}, {""id"": 2016, ""name"": ""vandalism""}, {""id"": 10183, ""name"": ""independent film""}, {""id"": 10726, ""name"": ""gang""}, {""id"": 12425, ""name"": ""racism""}, {""id"": 13088, ""name"": ""summer""}, {""id"": 14751, ""name"": ""youth""}, {""id"": 14819, ""name"": ""violence""}, {""id"": 14964, ""name"": ""drug""}, {""id"": 156052, ""name"": ""unemployment""}, {""id"": 160910, ""name"": ""xenophobia""}, {""id"": 162710, ""name"": ""culture""}]",en,This Is England,"A story about a troubled boy growing up in England, set in 1983. He comes across a few skinheads on his way home from school, after a fight. They become his new best friends even like family. Based on experiences of director Shane Meadows.",8.395624,"[{""name"": ""EM Media"", ""id"": 1917}, {""name"": ""UK Film Council"", ""id"": 2452}, {""name"": ""Screen Yorkshire"", ""id"": 2690}, {""name"": ""Big Arty Productions"", ""id"": 3519}]","[{""iso_3166_1"": ""GB"", ""name"": ""United Kingdom""}]",9/12/2006,8176544,101,"[{""iso_639_1"": ""en"", ""name"": ""English""}]",Released,"Run with the crowd, stand alone, you decide.",This Is England,7.4,363
50000000,"[{""id"": 80, ""name"": ""Crime""}, {""id"": 14, ""name"": ""Fantasy""}, {""id"": 18, ""name"": ""Drama""}]",http://www.parfum.film.de/,1427,"[{""id"": 90, ""name"": ""paris""}, {""id"": 293, ""name"": ""female nudity""}, {""id"": 549, ""name"": ""prostitute""}, {""id"": 1415, ""name"": ""small town""}, {""id"": 1523, ""name"": ""obsession""}, {""id"": 1817, ""name"": ""orgy""}, {""id"": 1866, ""name"": ""bad smell""}, {""id"": 2483, ""name"": ""nudity""}, {""id"": 3568, ""name"": ""lone wolf""}, {""id"": 5558, ""name"": ""lavender""}, {""id"": 5560, ""name"": ""nose""}, {""id"": 5561, ""name"": ""child prodigy""}, {""id"": 5562, ""name"": ""fish market""}, {""id"": 5600, ""name"": ""daughter""}, {""id"": 6152, ""name"": ""supernatural""}, {""id"": 6257, ""name"": ""genius""}, {""id"": 6272, ""name"": ""children's home""}, {""id"": 34079, ""name"": ""death""}, {""id"": 158194, ""name"": ""perfume""}]",en,Perfume: The Story of a Murderer,"Jean-Baptiste Grenouille, born in the stench of 18th century Paris, develops a superior olfactory sense, which he uses to create the world's finest perfumes. However, his work takes a dark turn as he tries to preserve scents in the search for the ultimate perfume.",42.551902,"[{""name"": ""Davis-Films"", ""id"": 342}, {""name"": ""Nouvelles \u00c9ditions de Films (NEF)"", ""id"": 753}, {""name"": ""Rising Star"", ""id"": 1208}, {""name"": ""VIP Medienfonds 4"", ""id"": 2116}, {""name"": ""Ikiru Films"", ""id"": 2875}, {""name"": ""Constantin Film Produktion"", ""id"": 5755}, {""name"": ""Castelao Producciones"", ""id"": 7956}]","[{""iso_3166_1"": ""ES"", ""name"": ""Spain""}, {""iso_3166_1"": ""DE"", ""name"": ""Germany""}, {""iso_3166_1"": ""FR"", ""name"": ""France""}]",9/13/2006,132180323,147,"[{""iso_639_1"": ""en"", ""name"": ""English""}]",Released,Based on the best-selling novel,Perfume: The Story of a Murderer,7.1,1165
76000000,"[{""id"": 18, ""name"": ""Drama""}, {""id"": 28, ""name"": ""Action""}, {""id"": 53, ""name"": ""Thriller""}, {""id"": 878, ""name"": ""Science Fiction""}]",http://www.universalstudiosentertainment.com/children-of-men/,9693,"[{""id"": 318, ""name"": ""police state""}, {""id"": 458, ""name"": ""hippie""}, {""id"": 526, ""name"": ""rebel""}, {""id"": 2618, ""name"": ""miracle""}, {""id"": 2964, ""name"": ""future""}, {""id"": 4565, ""name"": ""dystopia""}, {""id"": 4630, ""name"": ""chaos""}, {""id"": 4995, ""name"": ""aging""}, {""id"": 5885, ""name"": ""childlessness""}, {""id"": 6150, ""name"": ""faith""}, {""id"": 10349, ""name"": ""survival""}, {""id"": 17985, ""name"": ""birth""}, {""id"": 41589, ""name"": ""dying""}]",en,Children of Men,"In 2027, in a chaotic world in which humans can no longer procreate, a former activist agrees to help transport a miraculously pregnant woman to a sanctuary at sea, where her child's birth may help scientists save the future of humankind.",35.387874,"[{""name"": ""Universal Pictures"", ""id"": 33}, {""name"": ""Strike Entertainment"", ""id"": 655}, {""name"": ""Hit & Run Productions"", ""id"": 11429}]","[{""iso_3166_1"": ""GB"", ""name"": ""United Kingdom""}, {""iso_3166_1"": ""US"", ""name"": ""United States of America""}]",9/22/2006,69959751,109,"[{""iso_639_1"": ""en"", ""name"": ""English""}]",Released,The future's a thing of the past.,Children of Men,7.4,2071
90000000,"[{""id"": 18, ""name"": ""Drama""}, {""id"": 53, ""name"": ""Thriller""}, {""id"": 80, ""name"": ""Crime""}]",http://thedeparted.warnerbros.com/,1422,"[{""id"": 1568, ""name"": ""undercover""}, {""id"": 1680, ""name"": ""boston""}, {""id"": 6149, ""name"": ""police""}, {""id"": 9713, ""name"": ""friends""}, {""id"": 10391, ""name"": ""mafia""}, {""id"": 11199, ""name"": ""undercover cop""}, {""id"": 11578, ""name"": ""mobster""}, {""id"": 14617, ""name"": ""mole""}, {""id"": 177235, ""name"": ""state police""}, {""id"": 177258, ""name"": ""police training""}, {""id"": 177259, ""name"": ""realtor""}]",en,The Departed,"To take down South Boston's Irish Mafia, the police send in one of their own to infiltrate the underworld, not realizing the syndicate has done likewise. While an undercover cop curries favor with the mob kingpin, a career criminal rises through the police ranks. But both sides soon discover there's a mole among them.",63.429157,"[{""name"": ""Vertigo Entertainment"", ""id"": 829}, {""name"": ""Media Asia Films"", ""id"": 5552}, {""name"": ""Warner Bros."", ""id"": 6194}, {""name"": ""Initial Entertainment Group (IEG)"", ""id"": 7380}, {""name"": ""Plan B Entertainment"", ""id"": 45778}]","[{""iso_3166_1"": ""HK"", ""name"": ""Hong Kong""}, {""iso_3166_1"": ""US"", ""name"": ""United States of America""}]",10/5/2006,289847354,151,"[{""iso_639_1"": ""en"", ""name"": ""English""}, {""iso_639_1"": ""cn"", ""name"": ""\u5e7f\u5dde\u8bdd / \u5ee3\u5dde\u8a71""}]",Released,Lies. Betrayal. Sacrifice. How far will you take it?,The Departed,7.9,4339
40000000,"[{""id"": 18, ""name"": ""Drama""}, {""id"": 9648, ""name"": ""Mystery""}, {""id"": 53, ""name"": ""Thriller""}]",http://wwws.warnerbros.de/theprestige/,1124,"[{""id"": 271, ""name"": ""competition""}, {""id"": 1328, ""name"": ""secret""}, {""id"": 1523, ""name"": ""obsession""}, {""id"": 2343, ""name"": ""magic""}, {""id"": 3737, ""name"": ""dying and death""}, {""id"": 4034, ""name"": ""class society""}, {""id"": 4662, ""name"": ""illusion""}, {""id"": 4988, ""name"": ""tricks""}, {""id"": 6062, ""name"": ""hostility""}, {""id"": 6069, ""name"": ""class""}, {""id"": 9823, ""name"": ""rivalry""}]",en,The Prestige,"A mysterious story of two magicians whose intense rivalry leads them on a life-long battle for supremacy -- full of obsession, deceit and jealousy with dangerous and deadly consequences.",74.440708,"[{""name"": ""Warner Bros."", ""id"": 6194}, {""name"": ""Touchstone Pictures"", ""id"": 9195}, {""name"": ""Syncopy"", ""id"": 9996}]","[{""iso_3166_1"": ""US"", ""name"": ""United States of America""}]",10/19/2006,109676311,130,"[{""iso_639_1"": ""en"", ""name"": ""English""}]",Released,Are You Watching Closely?,The Prestige,8,4391
150000000,"[{""id"": 12, ""name"": ""Adventure""}, {""id"": 28, ""name"": ""Action""}, {""id"": 53, ""name"": ""Thriller""}]",http://www.mgm.com/#/our-titles/233/Casino-Royale-(2006),36557,"[{""id"": 131, ""name"": ""italy""}, {""id"": 383, ""name"": ""poker""}, {""id"": 585, ""name"": ""casino""}, {""id"": 949, ""name"": ""terrorist""}, {""id"": 3515, ""name"": ""banker""}, {""id"": 10594, ""name"": ""money""}, {""id"": 10609, ""name"": ""free running""}, {""id"": 13006, ""name"": ""torture""}, {""id"": 156095, ""name"": ""british secret service""}, {""id"": 206125, ""name"": ""montenegro""}]",en,Casino Royale,"Le Chiffre, a banker to the world's terrorists, is scheduled to participate in a high-stakes poker game in Montenegro, where he intends to use his winnings to establish his financial grip on the terrorist market. M sends Bond  on his maiden mission as a 00 Agent  to attend this game and prevent Le Chiffre from winning. With the help of Vesper Lynd and Felix Leiter, Bond enters the most important poker game in his already dangerous career.",88.935165,"[{""name"": ""Eon Productions"", ""id"": 7576}, {""name"": ""Stillking Films"", ""id"": 11345}, {""name"": ""Babelsberg Film"", ""id"": 19481}]","[{""iso_3166_1"": ""IT"", ""name"": ""Italy""}, {""iso_3166_1"": ""GB"", ""name"": ""United Kingdom""}, {""iso_3166_1"": ""US"", ""name"": ""United States of America""}, {""iso_3166_1"": ""CZ"", ""name"": ""Czech Republic""}, {""iso_3166_1"": ""DE"", ""name"": ""Germany""}]",11/14/2006,599045960,144,"[{""iso_639_1"": ""en"", ""name"": ""English""}, {""iso_639_1"": ""fr"", ""name"": ""Fran\u00e7ais""}]",Released,Everyone has a past. Every legend has a beginning.,Casino Royale,7.3,3855
