budget,genres,homepage,id,keywords,original_language,original_title,overview,popularity,production_companies,production_countries,release_date,revenue,runtime,spoken_languages,status,tagline,title,vote_average,vote_count
0,"[{""id"": 18, ""name"": ""Drama""}]",http://www.forcoloredgirlsmovie.com/,44944,"[{""id"": 293, ""name"": ""female nudity""}, {""id"": 493, ""name"": ""poem""}, {""id"": 570, ""name"": ""rape""}, {""id"": 9673, ""name"": ""love""}, {""id"": 11925, ""name"": ""domestic violence""}, {""id"": 33372, ""name"": ""womanhood""}]",en,For Colored Girls,"About existence from the perspective of 20 nameless black females. Each of the women portray one of the characters represented in the collection of twenty poems, revealing different issues that impact women in general and women of color in particular.",1.934524,"[{""name"": ""Lions Gate Films"", ""id"": 35}]","[{""iso_3166_1"": ""US"", ""name"": ""United States of America""}]",11/5/2010,37000000,134,"[{""iso_639_1"": ""en"", ""name"": ""English""}]",Released,Many voices. One poem.,For Colored Girls,7,22
18000000,"[{""id"": 12, ""name"": ""Adventure""}, {""id"": 18, ""name"": ""Drama""}, {""id"": 53, ""name"": ""Thriller""}]",,44115,"[{""id"": 1262, ""name"": ""mountains""}, {""id"": 2300, ""name"": ""despair""}, {""id"": 4414, ""name"": ""adventure""}, {""id"": 5303, ""name"": ""utah""}, {""id"": 6511, ""name"": ""alone""}, {""id"": 8122, ""name"": ""canyon""}, {""id"": 8624, ""name"": ""climbing""}, {""id"": 9672, ""name"": ""based on true story""}, {""id"": 10084, ""name"": ""rescue""}, {""id"": 10349, ""name"": ""survival""}, {""id"": 10685, ""name"": ""escape""}, {""id"": 10984, ""name"": ""true""}, {""id"": 18029, ""name"": ""trapped""}, {""id"": 159880, ""name"": ""boulder""}, {""id"": 175428, ""name"": ""adventurer""}, {""id"": 187844, ""name"": ""flashback""}, {""id"": 201712, ""name"": ""climber""}, {""id"": 201713, ""name"": ""isolated""}, {""id"": 201715, ""name"": ""hikers""}, {""id"": 212412, ""name"": ""very little dialogue""}]",en,127 Hours,The true story of mountain climber Aron Ralston's remarkable adventure to save himself after a fallen boulder crashes on his arm and traps him in an isolated canyon in Utah.,52.464877,"[{""name"": ""Fox Searchlight Pictures"", ""id"": 43}, {""name"": ""Warner Bros."", ""id"": 6194}, {""name"": ""Cloud Eight Films"", ""id"": 6708}, {""name"": ""Path\u00e9"", ""id"": 7981}, {""name"": ""Film4"", ""id"": 9349}, {""name"": ""Everest Entertainment"", ""id"": 10892}, {""name"": ""HandMade Films"", ""id"": 20076}]","[{""iso_3166_1"": ""GB"", ""name"": ""United Kingdom""}, {""iso_3166_1"": ""US"", ""name"": ""United States of America""}]",11/5/2010,35692920,94,"[{""iso_639_1"": ""en"", ""name"": ""English""}]",Released,There is no force more powerful than the will to live.,127 Hours,7,2606
8000000,"[{""id"": 35, ""name"": ""Comedy""}, {""id"": 18, ""name"": ""Drama""}]",http://www.anotheryear-movie.com/,44009,"[{""id"": 931, ""name"": ""jealousy""}, {""id"": 1918, ""name"": ""cooking""}, {""id"": 2105, ""name"": ""garden""}, {""id"": 3739, ""name"": ""funeral""}, {""id"": 3743, ""name"": ""season""}, {""id"": 9957, ""name"": ""loneliness""}, {""id"": 10048, ""name"": ""unrequited love""}, {""id"": 15230, ""name"": ""red wine""}]",en,Another Year,"Mike Leighs much praised 2010 tragicomical drama. During a year, a very content couple approaching retirement are visited by friends and family less happy with their lives.",7.235794,"[{""name"": ""Film4"", ""id"": 9349}, {""name"": ""Thin Man Films"", ""id"": 10100}]","[{""iso_3166_1"": ""GB"", ""name"": ""United Kingdom""}]",11/5/2010,18124262,129,"[{""iso_639_1"": ""en"", ""name"": ""English""}]",Released,,Another Year,7,97
260000000,"[{""id"": 16, ""name"": ""Animation""}, {""id"": 10751, ""name"": ""Family""}]",http://disney.go.com/disneypictures/tangled/,38757,"[{""id"": 1562, ""name"": ""hostage""}, {""id"": 2343, ""name"": ""magic""}, {""id"": 2673, ""name"": ""horse""}, {""id"": 3205, ""name"": ""fairy tale""}, {""id"": 4344, ""name"": ""musical""}, {""id"": 7376, ""name"": ""princess""}, {""id"": 10336, ""name"": ""animation""}, {""id"": 33787, ""name"": ""tower""}, {""id"": 155658, ""name"": ""blonde woman""}, {""id"": 162219, ""name"": ""selfishness""}, {""id"": 163545, ""name"": ""healing power""}, {""id"": 179411, ""name"": ""based on fairy tale""}, {""id"": 179431, ""name"": ""duringcreditsstinger""}, {""id"": 215258, ""name"": ""healing gift""}, {""id"": 234183, ""name"": ""animal sidekick""}]",en,Tangled,"When the kingdom's most wanted-and most charming-bandit Flynn Rider hides out in a mysterious tower, he's taken hostage by Rapunzel, a beautiful and feisty tower-bound teen with 70 feet of magical, golden hair. Flynn's curious captor, who's looking for her ticket out of the tower where she's been locked away for years, strikes a deal with the handsome thief and the unlikely duo sets off on an action-packed escapade, complete with a super-cop horse, an over-protective chameleon and a gruff gang of pub thugs.",48.681969,"[{""name"": ""Walt Disney Pictures"", ""id"": 2}, {""name"": ""Walt Disney Animation Studios"", ""id"": 6125}]","[{""iso_3166_1"": ""US"", ""name"": ""United States of America""}]",11/24/2010,591794936,100,"[{""iso_639_1"": ""en"", ""name"": ""English""}]",Released,They're taking adventure to new lengths.,Tangled,7.4,3330
13000000,"[{""id"": 18, ""name"": ""Drama""}, {""id"": 53, ""name"": ""Thriller""}]",http://www.foxsearchlight.com/blackswan/,44214,"[{""id"": 246, ""name"": ""dancing""}, {""id"": 271, ""name"": ""competition""}, {""id"": 572, ""name"": ""sex""}, {""id"": 733, ""name"": ""dancer""}, {""id"": 1523, ""name"": ""obsession""}, {""id"": 2340, ""name"": ""paranoia""}, {""id"": 6255, ""name"": ""insanity""}, {""id"": 9937, ""name"": ""suspense""}, {""id"": 10551, ""name"": ""ballet""}, {""id"": 14512, ""name"": ""new york city""}, {""id"": 34265, ""name"": ""heartbreak""}, {""id"": 41329, ""name"": ""mental illness""}, {""id"": 41410, ""name"": ""madness""}, {""id"": 173646, ""name"": ""swan lake""}, {""id"": 187256, ""name"": ""ballerina""}, {""id"": 191564, ""name"": ""body horror""}]",en,Black Swan,"A ballet dancer wins the lead in ""Swan Lake"" and is perfect for the role of the delicate White Swan - Princess Odette - but slowly loses her mind as she becomes more and more like Odile, the Black Swan.",91.285683,"[{""name"": ""Fox Searchlight Pictures"", ""id"": 43}, {""name"": ""Dune Entertainment"", ""id"": 444}, {""name"": ""Protozoa Pictures"", ""id"": 7503}, {""name"": ""Cross Creek Pictures"", ""id"": 10246}]","[{""iso_3166_1"": ""US"", ""name"": ""United States of America""}]",12/2/2010,327803731,108,"[{""iso_639_1"": ""en"", ""name"": ""English""}, {""iso_639_1"": ""fr"", ""name"": ""Fran\u00e7ais""}, {""iso_639_1"": ""it"", ""name"": ""Italiano""}]",Released,"In the era of personal branding, the scariest possibility is that someone might be better at being you than you are.",Black Swan,7.3,4430
25000000,"[{""id"": 18, ""name"": ""Drama""}]",http://www.thefightermovie.com,45317,"[{""id"": 6075, ""name"": ""sport""}, {""id"": 154123, ""name"": ""irish american""}, {""id"": 166309, ""name"": ""documentary crew""}, {""id"": 174093, ""name"": ""lowell massachusetts""}, {""id"": 174099, ""name"": ""blue collar worker""}, {""id"": 174107, ""name"": ""church bells""}, {""id"": 174109, ""name"": ""documentary filmmaking""}, {""id"": 174110, ""name"": ""boxer shorts""}, {""id"": 174116, ""name"": ""jumping rope""}, {""id"": 174117, ""name"": ""shadow boxing""}, {""id"": 179431, ""name"": ""duringcreditsstinger""}]",en,The Fighter,"The Fighter, is a drama about boxer ""Irish"" Micky Ward's unlikely road to the world light welterweight title. His Rocky-like rise was shepherded by half-brother Dicky, a boxer-turned-trainer who rebounded in life after nearly being KO'd by drugs and crime.",31.019381,"[{""name"": ""Paramount Pictures"", ""id"": 4}]","[{""iso_3166_1"": ""US"", ""name"": ""United States of America""}]",12/17/2010,93617009,116,"[{""iso_639_1"": ""en"", ""name"": ""English""}]",Released,Every dream deserves a fighting chance.,The Fighter,7.2,1486
38000000,"[{""id"": 18, ""name"": ""Drama""}, {""id"": 12, ""name"": ""Adventure""}, {""id"": 37, ""name"": ""Western""}]",http://www.truegritmovie.com/,44264,"[{""id"": 1872, ""name"": ""loss of father""}, {""id"": 2123, ""name"": ""father murder""}, {""id"": 5901, ""name"": ""texas ranger""}, {""id"": 7464, ""name"": ""alcoholism""}, {""id"": 10085, ""name"": ""betrayal""}]",en,True Grit,"Following the murder of her father by hired hand Tom Chaney, 14-year-old farm girl Mattie Ross sets out to capture the killer. To aid her, she hires the toughest U.S. Marshal she can find, a man with ""true grit,"" Reuben J. ""Rooster"" Cogburn. Mattie insists on accompanying Cogburn, whose drinking, sloth, and generally reprobate character do not augment her faith in him. Against his wishes, she joins him in his trek into the Indian Nations in search of Chaney. They are joined by Texas Ranger LaBoeuf, who wants Chaney for his own purposes. The unlikely trio find danger and adventure on the journey, and each has his or her ""grit"" tested.",49.292384,"[{""name"": ""Paramount Pictures"", ""id"": 4}, {""name"": ""Scott Rudin Productions"", ""id"": 258}, {""name"": ""Mike Zoss Productions"", ""id"": 2092}, {""name"": ""Skydance Productions"", ""id"": 6277}]","[{""iso_3166_1"": ""US"", ""name"": ""United States of America""}]",12/22/2010,252276927,110,"[{""iso_639_1"": ""en"", ""name"": ""English""}]",Released,Punishment Comes One Way or Another.,True Grit,7.2,1668
15000000,"[{""id"": 18, ""name"": ""Drama""}, {""id"": 10749, ""name"": ""Romance""}]",http://www.focusfeatures.com/one_day,51828,"[{""id"": 818, ""name"": ""based on novel""}, {""id"": 3485, ""name"": ""comedian""}, {""id"": 8438, ""name"": ""job""}, {""id"": 9673, ""name"": ""love""}, {""id"": 10556, ""name"": ""male female relationship""}, {""id"": 10818, ""name"": ""author""}, {""id"": 13028, ""name"": ""writer""}, {""id"": 15160, ""name"": ""divorce""}, {""id"": 178329, ""name"": ""best friends in love""}, {""id"": 187056, ""name"": ""woman director""}, {""id"": 217405, ""name"": ""missed opportunity""}]",en,One Day,"A romantic comedy centered on Dexter and Emma, who first meet during their graduation in 1988 and proceed to keep in touch regularly. The film follows what they do on July 15 annually, usually doing something together.",16.629173,"[{""name"": ""Film 4"", ""id"": 2335}, {""name"": ""Color Force"", ""id"": 5420}]","[{""iso_3166_1"": ""GB"", ""name"": ""United Kingdom""}, {""iso_3166_1"": ""US"", ""name"": ""United States of America""}]",3/2/2011,59389433,107,"[{""iso_639_1"": ""en"", ""name"": ""English""}]",Released,Twenty years. Two people.,One Day,7,978
40000000,"[{""id"": 80, ""name"": ""Crime""}, {""id"": 18, ""name"": ""Drama""}, {""id"": 53, ""name"": ""Thriller""}]",http://www.thelincolnlawyermovie.com/,50348,"[{""id"": 934, ""name"": ""judge""}, {""id"": 5638, ""name"": ""arrest""}, {""id"": 8881, ""name"": ""jury""}, {""id"": 11168, ""name"": ""private investigator""}]",en,The Lincoln Lawyer,A lawyer conducts business from the back of his Lincoln town car while representing a high-profile client in Beverly Hills.,26.072228,"[{""name"": ""Lakeshore Entertainment"", ""id"": 126}, {""name"": ""Sidney Kimmel Entertainment"", ""id"": 737}, {""name"": ""Lionsgate"", ""id"": 1632}]","[{""iso_3166_1"": ""US"", ""name"": ""United States of America""}]",3/17/2011,85412898,119,"[{""iso_639_1"": ""en"", ""name"": ""English""}]",Released,This Case is a Dangerous Game of Life and Death,The Lincoln Lawyer,7,902
32000000,"[{""id"": 53, ""name"": ""Thriller""}, {""id"": 878, ""name"": ""Science Fiction""}, {""id"": 9648, ""name"": ""Mystery""}]",http://www.enterthesourcecode.com/,45612,"[{""id"": 258, ""name"": ""bomb""}, {""id"": 1284, ""name"": ""identity""}, {""id"": 2486, ""name"": ""fantasy""}, {""id"": 2532, ""name"": ""bomber""}, {""id"": 3301, ""name"": ""suspicion""}, {""id"": 4379, ""name"": ""time travel""}, {""id"": 5340, ""name"": ""investigation""}, {""id"": 9887, ""name"": ""surrealism""}, {""id"": 13065, ""name"": ""soldier""}, {""id"": 14605, ""name"": ""helicopter pilot""}]",en,Source Code,"Decorated soldier Captain Colter Stevens wakes up in the body of an unknown man, discovering he's involved in a mission to find the bomber of a Chicago commuter train. He learns he's part of a top-secret experimental program that enables him to experience the final 8 minutes of another person's life. Colter re-lives the train incident over and over again, gathering more clues each time. But can he discover who is responsible for the attack before the next one happens?",59.19888,"[{""name"": ""The Mark Gordon Company"", ""id"": 1557}, {""name"": ""Vendome Pictures"", ""id"": 7460}]","[{""iso_3166_1"": ""CA"", ""name"": ""Canada""}, {""iso_3166_1"": ""US"", ""name"": ""United States of America""}]",3/30/2011,147332697,93,"[{""iso_639_1"": ""en"", ""name"": ""English""}]",Released,Make Every Second Count,Source Code,7.1,2699
125000000,"[{""id"": 28, ""name"": ""Action""}, {""id"": 53, ""name"": ""Thriller""}, {""id"": 80, ""name"": ""Crime""}]",http://www.watchvideoseries.com/movies/fast-five-2011-2/,51497,"[{""id"": 1161, ""name"": ""brazil""}, {""id"": 1812, ""name"": ""fbi""}, {""id"": 6089, ""name"": ""freedom""}, {""id"": 9777, ""name"": ""escape from prison""}, {""id"": 9844, ""name"": ""car crash""}, {""id"": 10051, ""name"": ""heist""}, {""id"": 10291, ""name"": ""organized crime""}, {""id"": 10562, ""name"": ""on the run""}, {""id"": 10594, ""name"": ""money""}, {""id"": 10718, ""name"": ""fugitive""}, {""id"": 11148, ""name"": ""police chase""}, {""id"": 12414, ""name"": ""escaped convict""}, {""id"": 33885, ""name"": ""car""}, {""id"": 156395, ""name"": ""imax""}, {""id"": 159953, ""name"": ""automobile racing""}, {""id"": 179431, ""name"": ""duringcreditsstinger""}]",en,Fast Five,"Former cop Brian O'Conner partners with ex-con Dom Toretto on the opposite side of the law. Since Brian and Mia Toretto broke Dom out of custody, they've blown across many borders to elude authorities. Now backed into a corner in Rio de Janeiro, they must pull one last job in order to gain their freedom.",7.255718,"[{""name"": ""Universal Pictures"", ""id"": 33}, {""name"": ""Original Film"", ""id"": 333}, {""name"": ""One Race Productions"", ""id"": 1225}]","[{""iso_3166_1"": ""US"", ""name"": ""United States of America""}]",4/20/2011,626137675,130,"[{""iso_639_1"": ""en"", ""name"": ""English""}, {""iso_639_1"": ""es"", ""name"": ""Espa\u00f1ol""}, {""iso_639_1"": ""pt"", ""name"": ""Portugu\u00eas""}, {""iso_639_1"": ""it"", ""name"": ""Italiano""}]",Released,Get the Fifth Gear.,Fast Five,7.1,2438
30000000,"[{""id"": 14, ""name"": ""Fantasy""}, {""id"": 35, ""name"": ""Comedy""}, {""id"": 10749, ""name"": ""Romance""}]",http://www.sonyclassics.com/midnightinparis,59436,"[{""id"": 90, ""name"": ""paris""}, {""id"": 437, ""name"": ""painter""}, {""id"": 703, ""name"": ""detective""}, {""id"": 818, ""name"": ""based on novel""}, {""id"": 888, ""name"": ""screenwriter""}, {""id"": 3691, ""name"": ""forbidden love""}, {""id"": 4379, ""name"": ""time travel""}, {""id"": 5152, ""name"": ""midnight""}, {""id"": 5609, ""name"": ""nostalgia""}, {""id"": 6162, ""name"": ""past""}, {""id"": 12438, ""name"": ""sculpture""}, {""id"": 155797, ""name"": ""hemingway""}]",en,Midnight in Paris,A romantic comedy about a family traveling to the French capital for business. The party includes a young engaged couple forced to confront the illusion that a life different from their own is better.,43.753585,"[{""name"": ""Gravier Productions"", ""id"": 1824}, {""name"": ""Televisi\u00f3 de Catalunya (TV3)"", ""id"": 8530}, {""name"": ""Vers\u00e1til Cinema"", ""id"": 8531}, {""name"": ""Mediapro"", ""id"": 12010}, {""name"": ""Pontchartrain Productions"", ""id"": 24785}]","[{""iso_3166_1"": ""ES"", ""name"": ""Spain""}, {""iso_3166_1"": ""US"", ""name"": ""United States of America""}]",5/11/2011,151119219,94,"[{""iso_639_1"": ""en"", ""name"": ""English""}, {""iso_639_1"": ""fr"", ""name"": ""Fran\u00e7ais""}, {""iso_639_1"": ""de"", ""name"": ""Deutsch""}, {""iso_639_1"": ""es"", ""name"": ""Espa\u00f1ol""}]",Released,,Midnight in Paris,7.4,1990
15000000,"[{""id"": 18, ""name"": ""Drama""}, {""id"": 35, ""name"": ""Comedy""}, {""id"": 10749, ""name"": ""Romance""}]",http://www.warnerbros.fr/the-artist,74643,"[{""id"": 887, ""name"": ""film producer""}, {""id"": 6966, ""name"": ""film history""}, {""id"": 10732, ""name"": ""movie studio""}, {""id"": 12396, ""name"": ""hollywood""}, {""id"": 15162, ""name"": ""dog""}, {""id"": 41390, ""name"": ""mustache""}, {""id"": 154800, ""name"": ""hollywoodland""}, {""id"": 154802, ""name"": ""silent film""}, {""id"": 154806, ""name"": ""marquee""}, {""id"": 158225, ""name"": ""terrier""}, {""id"": 162262, ""name"": ""movie star""}, {""id"": 164641, ""name"": ""flapper""}, {""id"": 188647, ""name"": ""silent film star""}]",en,The Artist,"Hollywood, 1927: As silent movie star George Valentin wonders if the arrival of talking pictures will cause him to fade into oblivion, he sparks with Peppy Miller, a young dancer set for a big break.",29.943316,"[{""name"": ""France 3 Cin\u00e9ma"", ""id"": 591}, {""name"": ""La Petite Reine"", ""id"": 1992}, {""name"": ""Studio 37"", ""id"": 2577}, {""name"": ""uFilm"", ""id"": 8676}, {""name"": ""Jouror Productions"", ""id"": 12391}, {""name"": ""La Classe Am\u00e9ricaine"", ""id"": 50630}, {""name"": ""JD Prod"", ""id"": 71510}]","[{""iso_3166_1"": ""BE"", ""name"": ""Belgium""}, {""iso_3166_1"": ""FR"", ""name"": ""France""}]",5/15/2011,133432856,100,"[{""iso_639_1"": ""fr"", ""name"": ""Fran\u00e7ais""}]",Released,A Breath Of Fresh Vintage Air,The Artist,7.3,1049
160000000,"[{""id"": 28, ""name"": ""Action""}, {""id"": 878, ""name"": ""Science Fiction""}, {""id"": 12, ""name"": ""Adventure""}]",http://www.x-menfirstclassmovie.com/,49538,"[{""id"": 591, ""name"": ""cia""}, {""id"": 1852, ""name"": ""mutant""}, {""id"": 1960, ""name"": ""mine""}, {""id"": 8828, ""name"": ""marvel comic""}, {""id"": 9715, ""name"": ""superhero""}, {""id"": 9717, ""name"": ""based on comic book""}, {""id"": 10761, ""name"": ""superhuman""}, {""id"": 12995, ""name"": ""historical fiction""}, {""id"": 18139, ""name"": ""nuclear war""}, {""id"": 181558, ""name"": ""cuban missile crisis""}, {""id"": 208731, ""name"": ""world war iii""}, {""id"": 208992, ""name"": ""1960s""}]",en,X-Men: First Class,"Before Charles Xavier and Erik Lensherr took the names Professor X and Magneto, they were two young men discovering their powers for the first time. Before they were arch-enemies, they were closest of friends, working together with other mutants (some familiar, some new), to stop the greatest threat the world has ever known.",3.195174,"[{""name"": ""Ingenious Film Partners"", ""id"": 289}, {""name"": ""Ingenious Media"", ""id"": 290}, {""name"": ""Twentieth Century Fox Film Corporation"", ""id"": 306}, {""name"": ""Donners' Company"", ""id"": 431}, {""name"": ""Dune Entertainment"", ""id"": 444}, {""name"": ""Dune Entertainment III"", ""id"": 6332}, {""name"": ""Marvel Entertainment"", ""id"": 7505}, {""name"": ""Bad Hat Harry Productions"", ""id"": 9168}, {""name"": ""Big Screen Productions"", ""id"": 10893}]","[{""iso_3166_1"": ""US"", ""name"": ""United States of America""}]",5/24/2011,353624124,132,"[{""iso_639_1"": ""de"", ""name"": ""Deutsch""}, {""iso_639_1"": ""en"", ""name"": ""English""}, {""iso_639_1"": ""es"", ""name"": ""Espa\u00f1ol""}, {""iso_639_1"": ""fr"", ""name"": ""Fran\u00e7ais""}, {""iso_639_1"": ""ru"", ""name"": ""P\u0443\u0441\u0441\u043a\u0438\u0439""}]",Released,Witness the moment that will change our world.,X-Men: First Class,7.1,5181
7400000,"[{""id"": 18, ""name"": ""Drama""}, {""id"": 878, ""name"": ""Science Fiction""}]",,62215,"[{""id"": 11327, ""name"": ""wedding reception""}, {""id"": 14755, ""name"": ""power outage""}, {""id"": 14756, ""name"": ""destruction of planet""}, {""id"": 14757, ""name"": ""wedding toast""}]",da,Melancholia,Two sisters find their already strained relationship challenged as a mysterious new planet threatens to collide with Earth.,36.173598,"[{""name"": ""Zentropa Entertainments"", ""id"": 76}, {""name"": ""Det Danske Filminstitut"", ""id"": 118}, {""name"": ""Danmarks Radio (DR)"", ""id"": 119}, {""name"": ""Memfis Film"", ""id"": 321}, {""name"": ""Eurimages"", ""id"": 850}, {""name"": ""Sveriges Television (SVT)"", ""id"": 3221}, {""name"": ""Canal+"", ""id"": 5358}, {""name"": ""Cin\u00e9Cin\u00e9ma"", ""id"": 6301}, {""name"": ""Slot Machine"", ""id"": 7777}, {""name"": ""Zentropa International Sweden"", ""id"": 8288}, {""name"": ""Zentropa International K\u00f6ln"", ""id"": 8289}, {""name"": ""Liberator Productions"", ""id"": 11239}, {""name"": ""Swedish Film Institute"", ""id"": 14804}, {""name"": ""Centre National du Cin\u00e9ma et de L'image Anim\u00e9e (CNC)"", ""id"": 17298}, {""name"": ""Film i V\u00e4st"", ""id"": 17513}, {""name"": ""Filmstiftung Nordrhein-Westfalen"", ""id"": 27897}, {""name"": ""Legion Entertainment"", ""id"": 38069}, {""name"": ""Edition Video"", ""id"": 38071}, {""name"": ""Nordisk Film Distribution"", ""id"": 38072}]","[{""iso_3166_1"": ""DK"", ""name"": ""Denmark""}, {""iso_3166_1"": ""FR"", ""name"": ""France""}, {""iso_3166_1"": ""DE"", ""name"": ""Germany""}, {""iso_3166_1"": ""SE"", ""name"": ""Sweden""}]",5/26/2011,21817298,136,"[{""iso_639_1"": ""en"", ""name"": ""English""}]",Released,Enjoy it while it lasts,Melancholia,7,885
50000000,"[{""id"": 35, ""name"": ""Comedy""}, {""id"": 18, ""name"": ""Drama""}, {""id"": 10749, ""name"": ""Romance""}]",http://crazystupidlove.warnerbros.com/index.html,50646,"[{""id"": 815, ""name"": ""soulmates""}, {""id"": 1599, ""name"": ""midlife crisis""}, {""id"": 5809, ""name"": ""marriage crisis""}, {""id"": 9094, ""name"": ""womanizer""}, {""id"": 9798, ""name"": ""law school""}, {""id"": 14532, ""name"": ""crazy""}, {""id"": 14534, ""name"": ""relationship""}]",en,"Crazy, Stupid, Love.","Cal Weaver is living the American dream. He has a good job, a beautiful house, great children and a beautiful wife, named Emily. Cal's seemingly perfect life unravels, however, when he learns that Emily has been unfaithful and wants a divorce. Over 40 and suddenly single, Cal is adrift in the fickle world of dating. Enter, Jacob Palmer, a self-styled player who takes Cal under his wing and teaches him how to be a hit with the ladies.",37.990705,"[{""name"": ""Warner Bros."", ""id"": 6194}]","[{""iso_3166_1"": ""US"", ""name"": ""United States of America""}]",7/29/2011,142851197,118,"[{""iso_639_1"": ""en"", ""name"": ""English""}]",Released,This Is Stupid,"Crazy, Stupid, Love.",7,2443
93000000,"[{""id"": 53, ""name"": ""Thriller""}, {""id"": 28, ""name"": ""Action""}, {""id"": 18, ""name"": ""Drama""}, {""id"": 878, ""name"": ""Science Fiction""}]",http://www.apeswillrise.com/,61791,"[{""id"": 2051, ""name"": ""intelligence""}, {""id"": 2172, ""name"": ""zoo""}, {""id"": 4392, ""name"": ""cage""}, {""id"": 4565, ""name"": ""dystopia""}, {""id"": 12393, ""name"": ""golden gate bridge""}, {""id"": 14759, ""name"": ""ape""}, {""id"": 15149, ""name"": ""monkey""}, {""id"": 158025, ""name"": ""medical research""}, {""id"": 158101, ""name"": ""alzheimer's disease""}]",en,Rise of the Planet of the Apes,"Scientist Will Rodman is determined to find a cure for Alzheimer's, the disease which has slowly consumed his father. Will feels certain he is close to a breakthrough and tests his latest serum on apes, noticing dramatic increases in intelligence and brain activity in the primate subjects  especially Caesar, his pet chimpanzee.",138.433168,"[{""name"": ""Ingenious Film Partners"", ""id"": 289}, {""name"": ""Ingenious Media"", ""id"": 290}, {""name"": ""Twentieth Century Fox Film Corporation"", ""id"": 306}, {""name"": ""Dune Entertainment"", ""id"": 444}, {""name"": ""Dune Entertainment III"", ""id"": 6332}, {""name"": ""Chernin Entertainment"", ""id"": 7076}, {""name"": ""Big Screen Productions"", ""id"": 10893}]","[{""iso_3166_1"": ""US"", ""name"": ""United States of America""}]",8/3/2011,482860185,105,"[{""iso_639_1"": ""en"", ""name"": ""English""}]",Released,Evolution Becomes Revolution.,Rise of the Planet of the Apes,7,4347
0,"[{""id"": 53, ""name"": ""Thriller""}, {""id"": 80, ""name"": ""Crime""}]",,70670,"[{""id"": 13095, ""name"": ""death of lover""}, {""id"": 14789, ""name"": ""art thief""}, {""id"": 15478, ""name"": ""art gallery""}, {""id"": 158927, ""name"": ""police investigation""}]",en,Hodejegerne,An accomplished headhunter risks everything to obtain a valuable painting owned by a former mercenary..,20.821846,"[{""name"": ""Nordisk Film"", ""id"": 235}, {""name"": ""Yellow Bird Films"", ""id"": 5746}, {""name"": ""Friland Produksjon"", ""id"": 8246}, {""name"": ""ARD Degeto Film"", ""id"": 10947}]","[{""iso_3166_1"": ""DE"", ""name"": ""Germany""}, {""iso_3166_1"": ""NO"", ""name"": ""Norway""}]",8/4/2011,15699707,100,"[{""iso_639_1"": ""da"", ""name"": ""Dansk""}, {""iso_639_1"": ""en"", ""name"": ""English""}, {""iso_639_1"": ""no"", ""name"": ""Norsk""}, {""iso_639_1"": ""ru"", ""name"": ""P\u0443\u0441\u0441\u043a\u0438\u0439""}]",Released,The hunt is on.,Headhunters,7.1,399
