budget,genres,homepage,id,keywords,original_language,original_title,overview,popularity,production_companies,production_countries,release_date,revenue,runtime,spoken_languages,status,tagline,title,vote_average,vote_count
17000000,"[{""id"": 12, ""name"": ""Adventure""}, {""id"": 18, ""name"": ""Drama""}, {""id"": 28, ""name"": ""Action""}, {""id"": 10749, ""name"": ""Romance""}]",,146,"[{""id"": 334, ""name"": ""flying""}, {""id"": 779, ""name"": ""martial arts""}, {""id"": 2063, ""name"": ""taskmaster""}, {""id"": 4575, ""name"": ""comb""}, {""id"": 4809, ""name"": ""tiger""}, {""id"": 5293, ""name"": ""desert thief""}, {""id"": 14604, ""name"": ""theft""}, {""id"": 18432, ""name"": ""female martial artist""}]",zh,,"Two warriors in pursuit of a stolen sword and a notorious fugitive are led to an impetuous, physically-skilled, teenage nobleman's daughter, who is at a crossroads in her life.",45.742254,"[{""name"": ""Sony Pictures Classics"", ""id"": 58}, {""name"": ""China Film Co-Production Corporation"", ""id"": 2269}, {""name"": ""Columbia Pictures Film Production Asia"", ""id"": 2798}, {""name"": ""Good Machine"", ""id"": 10565}, {""name"": ""EDKO Film"", ""id"": 12205}, {""name"": ""Asia Union Film & Entertainment Ltd."", ""id"": 20289}, {""name"": ""United China Vision"", ""id"": 20290}, {""name"": ""Zoom Hunt International Productions Company Ltd."", ""id"": 20291}]","[{""iso_3166_1"": ""CN"", ""name"": ""China""}, {""iso_3166_1"": ""HK"", ""name"": ""Hong Kong""}, {""iso_3166_1"": ""TW"", ""name"": ""Taiwan""}, {""iso_3166_1"": ""US"", ""name"": ""United States of America""}]",10/1/2000,213525736,120,"[{""iso_639_1"": ""zh"", ""name"": ""\u666e\u901a\u8bdd""}]",Released,"A timeless story of strength, secrets and two warriors who would never surrender.","Crouching Tiger, Hidden Dragon",7.2,927
9000000,"[{""id"": 9648, ""name"": ""Mystery""}, {""id"": 53, ""name"": ""Thriller""}]",http://www.otnemem.com/,77,"[{""id"": 30, ""name"": ""individual""}, {""id"": 328, ""name"": ""insulin""}, {""id"": 331, ""name"": ""tattoo""}, {""id"": 828, ""name"": ""waitress""}, {""id"": 1453, ""name"": ""amnesia""}, {""id"": 2669, ""name"": ""motel""}, {""id"": 3973, ""name"": ""insurance salesman""}, {""id"": 9748, ""name"": ""revenge""}, {""id"": 11469, ""name"": ""memory loss""}, {""id"": 33874, ""name"": ""polaroid""}, {""id"": 187844, ""name"": ""flashback""}, {""id"": 207268, ""name"": ""neo-noir""}]",en,Memento,"Suffering short-term memory loss after a head injury, Leonard Shelby embarks on a grim quest to find the lowlife who murdered his wife in this gritty, complex thriller that packs more knots than a hangman's noose. To carry out his plan, Shelby snaps Polaroids of people and places, jotting down contextual notes on the backs of photos to aid in his search and jog his memory. He even tattoos his own body in a desperate bid to remember.",60.715151,"[{""name"": ""Summit Entertainment"", ""id"": 491}, {""name"": ""Newmarket Capital Group"", ""id"": 506}, {""name"": ""Team Todd"", ""id"": 598}, {""name"": ""I Remember Productions"", ""id"": 34446}]","[{""iso_3166_1"": ""US"", ""name"": ""United States of America""}]",10/11/2000,39723096,113,"[{""iso_639_1"": ""en"", ""name"": ""English""}]",Released,Some memories are best forgotten.,Memento,8.1,4028
40000000,"[{""id"": 18, ""name"": ""Drama""}, {""id"": 10749, ""name"": ""Romance""}]",,10647,"[{""id"": 161868, ""name"": ""child's point of view""}, {""id"": 166625, ""name"": ""candlelight vigil""}, {""id"": 170365, ""name"": ""good deed""}, {""id"": 170375, ""name"": ""exotic dancer""}, {""id"": 170378, ""name"": ""schoolteacher""}, {""id"": 170380, ""name"": ""extra credit assignment""}, {""id"": 170383, ""name"": ""disfigurement""}, {""id"": 170389, ""name"": ""junior high school""}, {""id"": 170390, ""name"": ""burn injury""}, {""id"": 187056, ""name"": ""woman director""}]",en,Pay It Forward,"Like some other kids, 12-year-old Trevor McKinney believed in the goodness of human nature. Like many other kids, he was determined to change the world for the better. Unlike most other kids, he succeeded.",24.313684,"[{""name"": ""Bel Air Entertainment"", ""id"": 788}, {""name"": ""Warner Bros."", ""id"": 6194}]","[{""iso_3166_1"": ""US"", ""name"": ""United States of America""}]",10/12/2000,55707411,122,"[{""iso_639_1"": ""en"", ""name"": ""English""}]",Released,"When someone does you a big favor, don't pay it back... Pay It Forward",Pay It Forward,7,432
4500000,"[{""id"": 80, ""name"": ""Crime""}, {""id"": 18, ""name"": ""Drama""}]",http://www.requiemforadream.com/,641,"[{""id"": 1803, ""name"": ""drug addiction""}, {""id"": 2375, ""name"": ""junkie""}, {""id"": 2671, ""name"": ""heroin""}, {""id"": 3428, ""name"": ""speed""}, {""id"": 3429, ""name"": ""diet""}, {""id"": 6059, ""name"": ""unsociability""}, {""id"": 33625, ""name"": ""illegal prostitution""}]",en,Requiem for a Dream,The hopes and dreams of four ambitious people are shattered when their drug addictions begin spiraling out of control. A look into addiction and how it overcomes the mind and body.,11.573034,"[{""name"": ""Artisan Entertainment"", ""id"": 2188}]","[{""iso_3166_1"": ""US"", ""name"": ""United States of America""}]",10/27/2000,7390108,102,"[{""iso_639_1"": ""en"", ""name"": ""English""}]",Released,,Requiem for a Dream,7.9,2443
100000000,"[{""id"": 12, ""name"": ""Adventure""}, {""id"": 16, ""name"": ""Animation""}, {""id"": 35, ""name"": ""Comedy""}, {""id"": 10751, ""name"": ""Family""}, {""id"": 14, ""name"": ""Fantasy""}]",,11688,"[{""id"": 1291, ""name"": ""central and south america""}, {""id"": 1421, ""name"": ""birthday""}, {""id"": 2280, ""name"": ""emperor""}, {""id"": 3998, ""name"": ""palace""}, {""id"": 4152, ""name"": ""kingdom""}, {""id"": 9360, ""name"": ""berater""}, {""id"": 207745, ""name"": ""llama""}]",en,The Emperor's New Groove,"Kuzco is a self-centered emperor who summons Pacha from a village and to tell him that his home will be destroyed to make room for Kuzco's new summer home. Kuzco's advisor, Yzma, tries to poison Kuzco and accidentally turns him into a llama, who accidentally ends up in Pacha's village. Pacha offers to help Kuzco if he doesn't destroy his house, and so they form an unlikely partnership.",51.113717,"[{""name"": ""Walt Disney Pictures"", ""id"": 2}, {""name"": ""Walt Disney Feature Animation"", ""id"": 10217}]","[{""iso_3166_1"": ""US"", ""name"": ""United States of America""}]",12/9/2000,169327687,78,"[{""iso_639_1"": ""en"", ""name"": ""English""}]",Released,It's All About.....ME!,The Emperor's New Groove,7.2,1490
43000000,"[{""id"": 18, ""name"": ""Drama""}]",,711,"[{""id"": 213, ""name"": ""upper class""}, {""id"": 380, ""name"": ""brother brother relationship""}, {""id"": 388, ""name"": ""scotland""}, {""id"": 496, ""name"": ""poetry""}, {""id"": 818, ""name"": ""based on novel""}, {""id"": 1310, ""name"": ""mentor""}, {""id"": 1412, ""name"": ""becoming an adult""}, {""id"": 1992, ""name"": ""professor""}, {""id"": 2132, ""name"": ""literature""}, {""id"": 3192, ""name"": ""intellectually gifted""}, {""id"": 3548, ""name"": ""plagiarism""}, {""id"": 3549, ""name"": ""literature competition""}, {""id"": 3551, ""name"": ""private school""}, {""id"": 3553, ""name"": ""manuscript""}, {""id"": 3556, ""name"": ""seclusion""}, {""id"": 3558, ""name"": ""pulitzer prize""}, {""id"": 3737, ""name"": ""dying and death""}, {""id"": 5614, ""name"": ""idol""}, {""id"": 6054, ""name"": ""friendship""}, {""id"": 6059, ""name"": ""unsociability""}, {""id"": 6270, ""name"": ""high school""}, {""id"": 6278, ""name"": ""scholarship""}, {""id"": 170652, ""name"": ""father figure""}]",en,Finding Forrester,Gus van Sant tells the story of a young African American man named Jamal who confronts his talents while living on the streets of the Bronx. He accidentally runs into an old writer named Forrester who discovers his passion for writing. With help from his new mentor Jamal receives a scholarship to a private school.,19.043286,"[{""name"": ""Fountainbridge Films"", ""id"": 414}, {""name"": ""Laurence Mark Productions"", ""id"": 415}, {""name"": ""Columbia Pictures Corporation"", ""id"": 441}, {""name"": ""Finding Forrester Productions"", ""id"": 50830}]","[{""iso_3166_1"": ""US"", ""name"": ""United States of America""}]",12/21/2000,80049764,136,"[{""iso_639_1"": ""en"", ""name"": ""English""}]",Released,"In an ordinary place, he found the one person to make his life extraordinary.",Finding Forrester,7,302
90000000,"[{""id"": 12, ""name"": ""Adventure""}, {""id"": 18, ""name"": ""Drama""}]",,8358,"[{""id"": 911, ""name"": ""exotic island""}, {""id"": 1252, ""name"": ""suicide attempt""}, {""id"": 5605, ""name"": ""volleyball""}, {""id"": 9957, ""name"": ""loneliness""}, {""id"": 12617, ""name"": ""airplane crash""}, {""id"": 155746, ""name"": ""deserted island""}, {""id"": 157524, ""name"": ""tropical island""}, {""id"": 170319, ""name"": ""survival skills""}]",en,Cast Away,"Chuck, a top international manager for FedEx, and Kelly, a Ph.D. student, are in love and heading towards marriage. Then Chuck's plane to Malaysia ditches at sea during a terrible storm. He's the only survivor, and he washes up on a tiny island with nothing but some flotsam and jetsam from the aircraft's cargo.",57.739713,"[{""name"": ""DreamWorks SKG"", ""id"": 27}, {""name"": ""Twentieth Century Fox Film Corporation"", ""id"": 306}, {""name"": ""Playtone"", ""id"": 4171}, {""name"": ""ImageMovers"", ""id"": 11395}]","[{""iso_3166_1"": ""US"", ""name"": ""United States of America""}]",12/22/2000,429632142,143,"[{""iso_639_1"": ""ru"", ""name"": ""P\u0443\u0441\u0441\u043a\u0438\u0439""}, {""iso_639_1"": ""en"", ""name"": ""English""}]",Released,"At the edge of the world, his journey begins.",Cast Away,7.5,3218
52500000,"[{""id"": 18, ""name"": ""Drama""}, {""id"": 10402, ""name"": ""Music""}, {""id"": 10749, ""name"": ""Romance""}]",,824,"[{""id"": 4235, ""name"": ""duke""}, {""id"": 4344, ""name"": ""musical""}, {""id"": 5914, ""name"": ""writer's block""}, {""id"": 6027, ""name"": ""music""}, {""id"": 6564, ""name"": ""terminal illness""}, {""id"": 13028, ""name"": ""writer""}, {""id"": 158111, ""name"": ""no opening credits""}, {""id"": 164753, ""name"": ""moulin rouge""}, {""id"": 164754, ""name"": ""bohemian""}, {""id"": 164759, ""name"": ""toulouse lautrec""}, {""id"": 164764, ""name"": ""red curtain""}, {""id"": 164770, ""name"": ""cancan dance""}, {""id"": 164772, ""name"": ""la traviata""}, {""id"": 164775, ""name"": ""orpheus and eurydice""}, {""id"": 186403, ""name"": ""dance hall""}]",en,Moulin Rouge!,"A celebration of love and creative inspiration takes place in the infamous, gaudy and glamorous Parisian nightclub, at the cusp of the 20th century. A young poet, who is plunged into the heady world of Moulin Rouge, begins a passionate affair with the club's most notorious and beautiful star.",57.374341,"[{""name"": ""Bazmark Films"", ""id"": 240}, {""name"": ""Twentieth Century Fox Film Corporation"", ""id"": 306}]","[{""iso_3166_1"": ""AU"", ""name"": ""Australia""}, {""iso_3166_1"": ""US"", ""name"": ""United States of America""}]",3/9/2001,179213434,127,"[{""iso_639_1"": ""fr"", ""name"": ""Fran\u00e7ais""}, {""iso_639_1"": ""es"", ""name"": ""Espa\u00f1ol""}, {""iso_639_1"": ""en"", ""name"": ""English""}]",Released,No Laws. No Limits. One Rule. Never Fall In Love.,Moulin Rouge!,7.4,1300
68000000,"[{""id"": 10752, ""name"": ""War""}]",,853,"[{""id"": 1442, ""name"": ""winter""}, {""id"": 1589, ""name"": ""sniper""}, {""id"": 1956, ""name"": ""world war ii""}, {""id"": 4264, ""name"": ""stalingrad""}]",en,Enemy at the Gates,Enemy at the Gates is a war film from Jean-Jacques Annaud from 2001 that takes place during the battle of Stalingard in World War II between the Russians and the Germans.,41.273567,"[{""name"": ""Paramount Pictures"", ""id"": 4}, {""name"": ""Swanford Films"", ""id"": 549}, {""name"": ""Mandalay Pictures"", ""id"": 551}, {""name"": ""Little Bird"", ""id"": 11358}, {""name"": ""KC Medien"", ""id"": 22182}, {""name"": ""Reperage"", ""id"": 24136}, {""name"": ""DOS"", ""id"": 24137}, {""name"": ""MP Film Management"", ""id"": 24138}]","[{""iso_3166_1"": ""IE"", ""name"": ""Ireland""}, {""iso_3166_1"": ""US"", ""name"": ""United States of America""}, {""iso_3166_1"": ""DE"", ""name"": ""Germany""}, {""iso_3166_1"": ""GB"", ""name"": ""United Kingdom""}]",3/13/2001,96976270,131,"[{""iso_639_1"": ""de"", ""name"": ""Deutsch""}, {""iso_639_1"": ""en"", ""name"": ""English""}, {""iso_639_1"": ""ru"", ""name"": ""P\u0443\u0441\u0441\u043a\u0438\u0439""}]",Released,Some Men Are Born To Be Heroes.,Enemy at the Gates,7.2,999
53000000,"[{""id"": 80, ""name"": ""Crime""}, {""id"": 18, ""name"": ""Drama""}]",,4133,"[{""id"": 1228, ""name"": ""1970s""}, {""id"": 1601, ""name"": ""war on drugs""}, {""id"": 1803, ""name"": ""drug addiction""}, {""id"": 2149, ""name"": ""drug traffic""}, {""id"": 3391, ""name"": ""drug smuggle""}, {""id"": 6974, ""name"": ""rise and fall""}]",en,Blow,"A boy named George Jung grows up in a struggling family in the 1950's. His mother nags at her husband as he is trying to make a living for the family. It is finally revealed that George's father cannot make a living and the family goes bankrupt. George does not want the same thing to happen to him, and his friend Tuna, in the 1960's, suggests that he deal marijuana. He is a big hit in California in the 1960's, yet he goes to jail, where he finds out about the wonders of cocaine. As a result, when released, he gets rich by bringing cocaine to America. However, he soon pays the price.",28.350529,"[{""name"": ""New Line Cinema"", ""id"": 12}]","[{""iso_3166_1"": ""US"", ""name"": ""United States of America""}]",4/4/2001,83282296,124,"[{""iso_639_1"": ""en"", ""name"": ""English""}]",Released,Based on a True Story.,Blow,7.4,1317
10000000,"[{""id"": 35, ""name"": ""Comedy""}, {""id"": 10749, ""name"": ""Romance""}]",http://www.die-fabelhafte-welt-der-amelie.de,194,"[{""id"": 90, ""name"": ""paris""}, {""id"": 128, ""name"": ""love triangle""}, {""id"": 365, ""name"": ""ghost train""}, {""id"": 366, ""name"": ""sex-shop""}, {""id"": 367, ""name"": ""shyness""}, {""id"": 1407, ""name"": ""montmartre""}, {""id"": 5600, ""name"": ""daughter""}, {""id"": 5972, ""name"": ""garden gnome""}, {""id"": 5973, ""name"": ""journey round the world""}, {""id"": 6025, ""name"": ""photography""}]",fr,Le fabuleux destin d'Amlie Poulain,"At a tiny Parisian caf, the adorable yet painfully shy Amlie (Audrey Tautou) accidentally discovers a gift for helping others. Soon Amelie is spending her days as a matchmaker, guardian angel, and all-around do-gooder. But when she bumps into a handsome stranger, will she find the courage to become the star of her very own love story?",73.720244,"[{""name"": ""France 3 Cin\u00e9ma"", ""id"": 591}, {""name"": ""Claudie Ossard Productions"", ""id"": 592}, {""name"": ""MMC Independent"", ""id"": 4411}, {""name"": ""Canal+"", ""id"": 5358}, {""name"": ""Tapioca Films"", ""id"": 12000}, {""name"": ""Sofica Sofinergie 5"", ""id"": 23446}, {""name"": ""Victoires Productions"", ""id"": 25020}, {""name"": ""Filmstiftung Nordrhein-Westfalen"", ""id"": 27897}, {""name"": ""Union G\u00e9n\u00e9rale Cin\u00e9matographique (UGC)"", ""id"": 30994}]","[{""iso_3166_1"": ""FR"", ""name"": ""France""}, {""iso_3166_1"": ""DE"", ""name"": ""Germany""}]",4/25/2001,173921954,122,"[{""iso_639_1"": ""fr"", ""name"": ""Fran\u00e7ais""}, {""iso_639_1"": ""ru"", ""name"": ""P\u0443\u0441\u0441\u043a\u0438\u0439""}]",Released,One person can change your life forever.,Amlie,7.8,3310
60000000,"[{""id"": 12, ""name"": ""Adventure""}, {""id"": 16, ""name"": ""Animation""}, {""id"": 35, ""name"": ""Comedy""}, {""id"": 10751, ""name"": ""Family""}, {""id"": 14, ""name"": ""Fantasy""}]",http://www.shrek.com/,808,"[{""id"": 2343, ""name"": ""magic""}, {""id"": 2434, ""name"": ""liberation""}, {""id"": 2596, ""name"": ""lordship""}, {""id"": 3098, ""name"": ""castle""}, {""id"": 4147, ""name"": ""robin hood""}, {""id"": 4158, ""name"": ""enchantment""}, {""id"": 6187, ""name"": ""fairy-tale figure""}, {""id"": 7376, ""name"": ""princess""}, {""id"": 9755, ""name"": ""parody""}, {""id"": 187056, ""name"": ""woman director""}, {""id"": 189111, ""name"": ""ogre""}]",en,Shrek,"It ain't easy bein' green -- especially if you're a likable (albeit smelly) ogre named Shrek. On a mission to retrieve a gorgeous princess from the clutches of a fire-breathing dragon, Shrek teams up with an unlikely compatriot -- a wisecracking donkey.",67.298732,"[{""name"": ""DreamWorks SKG"", ""id"": 27}, {""name"": ""Pacific Data Images (PDI)"", ""id"": 520}, {""name"": ""DreamWorks Animation"", ""id"": 521}]","[{""iso_3166_1"": ""US"", ""name"": ""United States of America""}]",5/16/2001,484409218,90,"[{""iso_639_1"": ""en"", ""name"": ""English""}]",Released,The greatest fairy tale never told.,Shrek,7.3,4056
15000000,"[{""id"": 53, ""name"": ""Thriller""}, {""id"": 18, ""name"": ""Drama""}, {""id"": 9648, ""name"": ""Mystery""}]",,1018,"[{""id"": 222, ""name"": ""schizophrenia""}, {""id"": 1284, ""name"": ""identity""}, {""id"": 1453, ""name"": ""amnesia""}, {""id"": 1565, ""name"": ""loss of sense of reality""}, {""id"": 1660, ""name"": ""suppressed past""}, {""id"": 2754, ""name"": ""trauma""}, {""id"": 2849, ""name"": ""key""}, {""id"": 3183, ""name"": ""bisexuality""}, {""id"": 3298, ""name"": ""hallucination""}, {""id"": 3307, ""name"": ""surreal""}, {""id"": 3489, ""name"": ""job interview""}, {""id"": 4623, ""name"": ""casting""}, {""id"": 9937, ""name"": ""suspense""}, {""id"": 10183, ""name"": ""independent film""}, {""id"": 10768, ""name"": ""lesbian""}, {""id"": 12670, ""name"": ""los angeles""}]",en,Mulholland Drive,"After a car wreck on the winding Mulholland Drive renders a woman amnesic, she and a perky Hollywood-hopeful search for clues and answers across Los Angeles in a twisting venture beyond dreams and reality.",31.60985,"[{""name"": ""Asymmetrical Productions"", ""id"": 373}, {""name"": ""Les Films Alain Sarde"", ""id"": 635}, {""name"": ""Babbo Inc."", ""id"": 636}, {""name"": ""The Picture Factory"", ""id"": 637}, {""name"": ""Canal+"", ""id"": 5358}]","[{""iso_3166_1"": ""FR"", ""name"": ""France""}, {""iso_3166_1"": ""US"", ""name"": ""United States of America""}]",5/16/2001,20117339,147,"[{""iso_639_1"": ""es"", ""name"": ""Espa\u00f1ol""}, {""iso_639_1"": ""en"", ""name"": ""English""}]",Released,An actress longing to be a star. A woman searching for herself. Both worlds will collide... on Mulholland Drive.,Mulholland Drive,7.6,1477
5000000,"[{""id"": 18, ""name"": ""Drama""}, {""id"": 10749, ""name"": ""Romance""}]",,1391,"[{""id"": 534, ""name"": ""mexico""}, {""id"": 572, ""name"": ""sex""}, {""id"": 966, ""name"": ""beach""}, {""id"": 2426, ""name"": ""group sex""}, {""id"": 3230, ""name"": ""male friendship""}, {""id"": 7312, ""name"": ""road trip""}, {""id"": 10683, ""name"": ""coming of age""}, {""id"": 13130, ""name"": ""teenager""}, {""id"": 158718, ""name"": ""lgbt""}, {""id"": 209987, ""name"": ""new mexican cinema""}]",es,Y tu mam tambin,"In Mexico, two teenage boys and an attractive older woman embark on a road trip and learn a thing or two about life, friendship, sex, and each other.",16.890285,"[{""name"": ""B\u00e9same Mucho Pictures"", ""id"": 1101}, {""name"": ""Producciones Anhelo"", ""id"": 1102}, {""name"": ""The Criterion Collection"", ""id"": 10932}]","[{""iso_3166_1"": ""MX"", ""name"": ""Mexico""}]",6/8/2001,33616692,106,"[{""iso_639_1"": ""es"", ""name"": ""Espa\u00f1ol""}]",Released,Life has its ways of teaching. Life has its ways to confuse us. Life has its ways to move us. Life has its ways to amaze. Life has its ways to hurt us. Life has its ways to heal. Life has its ways to inspire.,Y Tu Mam Tambin,7.3,315
16000000,"[{""id"": 80, ""name"": ""Crime""}, {""id"": 18, ""name"": ""Drama""}, {""id"": 10749, ""name"": ""Romance""}]",,16161,"[{""id"": 641, ""name"": ""single parent""}, {""id"": 3010, ""name"": ""intolerance""}, {""id"": 4313, ""name"": ""condom""}, {""id"": 5419, ""name"": ""bootlegger""}, {""id"": 5572, ""name"": ""fistfight""}, {""id"": 6669, ""name"": ""step father""}, {""id"": 9094, ""name"": ""womanizer""}, {""id"": 9727, ""name"": ""thief""}, {""id"": 11925, ""name"": ""domestic violence""}, {""id"": 12371, ""name"": ""gunfight""}, {""id"": 12670, ""name"": ""los angeles""}, {""id"": 155794, ""name"": ""physical abuse""}, {""id"": 156121, ""name"": ""ex-con""}, {""id"": 162219, ""name"": ""selfishness""}, {""id"": 162224, ""name"": ""passive aggression""}, {""id"": 162225, ""name"": ""fatherhood""}, {""id"": 162236, ""name"": ""convicted felon""}, {""id"": 234469, ""name"": ""south central l.a.""}]",en,Baby Boy,"The story of Jody, a misguided, 20-year-old African-American who is really just a baby boy finally forced-kicking and screaming to face the commitments of real life. Streetwise and jobless, he has not only fathered two children by two different women-Yvette and Peanut but still lives with his own mother. He can't seem to strike a balance or find direction in his chaotic life.",7.854989,"[{""name"": ""Columbia Pictures"", ""id"": 5}, {""name"": ""New Deal Productions"", ""id"": 1947}]","[{""iso_3166_1"": ""US"", ""name"": ""United States of America""}]",6/27/2001,29381649,130,"[{""iso_639_1"": ""en"", ""name"": ""English""}]",Released,Just a Baby Boy.,Baby Boy,7.4,55
15000000,"[{""id"": 14, ""name"": ""Fantasy""}, {""id"": 12, ""name"": ""Adventure""}, {""id"": 16, ""name"": ""Animation""}, {""id"": 10751, ""name"": ""Family""}]",http://movies.disney.com/spirited-away,129,"[{""id"": 616, ""name"": ""witch""}, {""id"": 970, ""name"": ""parents kids relationship""}, {""id"": 2343, ""name"": ""magic""}, {""id"": 2640, ""name"": ""twilight""}, {""id"": 3762, ""name"": ""darkness""}, {""id"": 3787, ""name"": ""village and town""}, {""id"": 4652, ""name"": ""bath house""}, {""id"": 4931, ""name"": ""pig""}, {""id"": 5280, ""name"": ""ghost world""}, {""id"": 6016, ""name"": ""biology""}, {""id"": 13008, ""name"": ""train""}, {""id"": 155582, ""name"": ""amusement park""}, {""id"": 196509, ""name"": ""yokai""}, {""id"": 207695, ""name"": ""japanese mythology""}, {""id"": 210024, ""name"": ""anime""}]",ja,,A ten year old girl who wanders away from her parents along a path that leads to a world ruled by strange and unusual monster-like animals. Her parents have been changed into pigs along with others inside a bathhouse full of these creatures. Will she ever see the world how it once was?,118.968562,"[{""name"": ""Studio Ghibli"", ""id"": 10342}]","[{""iso_3166_1"": ""JP"", ""name"": ""Japan""}]",7/20/2001,274925095,125,"[{""iso_639_1"": ""ja"", ""name"": ""\u65e5\u672c\u8a9e""}]",Released,The tunnel led Chihiro to a mysterious town...,Spirited Away,8.3,3840
45000000,"[{""id"": 28, ""name"": ""Action""}, {""id"": 80, ""name"": ""Crime""}, {""id"": 18, ""name"": ""Drama""}, {""id"": 53, ""name"": ""Thriller""}]",,2034,"[{""id"": 796, ""name"": ""police brutality""}, {""id"": 1601, ""name"": ""war on drugs""}, {""id"": 2149, ""name"": ""drug traffic""}, {""id"": 2231, ""name"": ""drug dealer""}, {""id"": 12670, ""name"": ""los angeles""}, {""id"": 33426, ""name"": ""gang member""}, {""id"": 164253, ""name"": ""mexican american""}, {""id"": 183637, ""name"": ""barrio""}, {""id"": 206318, ""name"": ""cholo""}]",en,Training Day,"On his first day on the job as a narcotics officer, a rookie cop works with a rogue detective who isn't what he appears.",52.081131,"[{""name"": ""Village Roadshow Pictures"", ""id"": 79}, {""name"": ""NPV Entertainment"", ""id"": 172}, {""name"": ""Warner Bros."", ""id"": 6194}, {""name"": ""Outlaw Productions (I)"", ""id"": 19507}, {""name"": ""WV Films II"", ""id"": 24939}]","[{""iso_3166_1"": ""AU"", ""name"": ""Australia""}, {""iso_3166_1"": ""US"", ""name"": ""United States of America""}]",10/5/2001,104876233,122,"[{""iso_639_1"": ""en"", ""name"": ""English""}, {""iso_639_1"": ""ru"", ""name"": ""P\u0443\u0441\u0441\u043a\u0438\u0439""}, {""iso_639_1"": ""es"", ""name"": ""Espa\u00f1ol""}, {""iso_639_1"": ""ko"", ""name"": ""\ud55c\uad6d\uc5b4/\uc870\uc120\ub9d0""}]",Released,"The only thing more dangerous than the line being crossed, is the cop who will cross it.",Training Day,7.3,1634
21000000,"[{""id"": 35, ""name"": ""Comedy""}, {""id"": 18, ""name"": ""Drama""}]",,9428,"[{""id"": 3446, ""name"": ""forgiveness""}, {""id"": 5561, ""name"": ""child prodigy""}, {""id"": 6564, ""name"": ""terminal illness""}, {""id"": 10041, ""name"": ""dysfunctional family""}, {""id"": 11732, ""name"": ""cigarette smoking""}, {""id"": 155294, ""name"": ""family conflict""}]",en,The Royal Tenenbaums,An estranged family of former child prodigies reunites when their father announces he has a terminal illness.,24.13081,"[{""name"": ""Touchstone Pictures"", ""id"": 9195}]","[{""iso_3166_1"": ""US"", ""name"": ""United States of America""}]",10/5/2001,71441250,110,"[{""iso_639_1"": ""en"", ""name"": ""English""}, {""iso_639_1"": ""it"", ""name"": ""Italiano""}]",Released,"Family isnt a word, its a sentence.",The Royal Tenenbaums,7.4,1286
72000000,"[{""id"": 28, ""name"": ""Action""}, {""id"": 18, ""name"": ""Drama""}, {""id"": 53, ""name"": ""Thriller""}]",,2100,"[{""id"": 378, ""name"": ""prison""}, {""id"": 1402, ""name"": ""general""}]",en,The Last Castle,A Court Martialed general rallies together 1200 inmates to rise against the system that put him away.,15.433244,"[{""name"": ""DreamWorks SKG"", ""id"": 27}]","[{""iso_3166_1"": ""US"", ""name"": ""United States of America""}]",10/19/2001,27642707,131,"[{""iso_639_1"": ""en"", ""name"": ""English""}]",Released,A Castle Can Only Have One King,The Last Castle,7,285
